{
  "eventId": "01ARZ3NDEKTSV4RRFFQ69G5FAY",
  "eventType": "Archived",
  "schemaVersion": 1,
  "workspaceId": "11111111-1111-4111-8111-111111111111",
  "targetType": "object",
  "targetId": "33333333-3333-4333-8333-333333333333",
  "version": 2,
  "before": { "status": "DRAFT" },
  "after": { "status": "VOID", "reason": "obsolete" },
  "actor": { "kind": "user", "id": "user-1" },
  "source": "manual",
  "occurredAt": "2026-06-13T00:00:00Z",
  "correlationId": "22222222-2222-4222-8222-222222222222",
  "causationId": "01ARZ3NDEKTSV4RRFFQ69G5FAZ",
  "sequence": 2
}
