{
  "actor": {
    "id": "test-user",
    "kind": "user"
  },
  "after": {
    "fieldDefCode": "cost",
    "value": 11
  },
  "before": {
    "fieldDefCode": "cost",
    "value": 10
  },
  "causationId": "01ARZ3NDEKTSV4RRFFQ69G5FAA",
  "correlationId": "22222222-2222-4222-8222-222222222222",
  "eventId": "01ARZ3NDEKTSV4RRFFQ69G5FAB",
  "eventType": "FieldChanged",
  "occurredAt": "2026-06-12T00:00:00Z",
  "schemaVersion": 1,
  "sequence": 2,
  "source": "manual",
  "targetId": "33333333-3333-4333-8333-333333333333:cost",
  "targetType": "fieldValue",
  "version": 2,
  "workspaceId": "11111111-1111-4111-8111-111111111111"
}
