{
  "eventId": "01ARZ3NDEKTSV4RRFFQ69G5FAW",
  "eventType": "RelationCreated",
  "schemaVersion": 1,
  "workspaceId": "11111111-1111-4111-8111-111111111111",
  "targetType": "relation",
  "targetId": "66666666-6666-4666-8666-666666666666",
  "version": 1,
  "before": null,
  "after": {
    "relationTypeId": "44444444-4444-4444-8444-444444444441",
    "sourceId": "77777777-7777-4777-8777-777777777777",
    "targetId": "88888888-8888-4888-8888-888888888888",
    "fields": { "weight": 1 }
  },
  "actor": { "kind": "user", "id": "user-1" },
  "source": "manual",
  "occurredAt": "2026-06-13T00:00:00Z",
  "correlationId": "22222222-2222-4222-8222-222222222222",
  "causationId": "01ARZ3NDEKTSV4RRFFQ69G5FAX",
  "sequence": 1
}
